{
  "$schema": "https://json-schema.org/draft/2020-12/schema",
  "$id": "aigame/preset.schema.json",
  "title": "AIGame Preset",
  "description": "A .preset.json file. Controls sampling and how the prompt is assembled. Editable in both the creator and the game.",
  "type": "object",
  "required": ["spec", "spec_version", "name", "blocks"],
  "additionalProperties": false,
  "properties": {
    "spec": { "const": "aigame-preset" },
    "spec_version": { "type": "string", "pattern": "^\\d+\\.\\d+$" },
    "name": { "type": "string" },
    "description": { "type": "string" },
    "sampling": {
      "description": "Omitted values are not sent, so the provider default applies.",
      "type": "object",
      "additionalProperties": false,
      "properties": {
        "temperature": { "type": "number", "minimum": 0, "maximum": 2 },
        "top_p": { "type": "number", "minimum": 0, "maximum": 1 },
        "top_k": { "type": "integer", "minimum": 0 },
        "frequency_penalty": { "type": "number" },
        "presence_penalty": { "type": "number" },
        "max_tokens": { "type": "integer", "minimum": 1 }
      }
    },
    "context": {
      "type": "object",
      "additionalProperties": false,
      "properties": {
        "max_context_tokens": { "type": "integer", "minimum": 1024 },
        "summarize_after_turns": { "type": "integer", "minimum": 0, "description": "Turns older than this are folded into the running summary. 0 disables." }
      }
    },
    "suggestions": {
      "type": "object",
      "additionalProperties": false,
      "properties": {
        "enabled": { "type": "boolean", "default": true },
        "count": { "type": "integer", "minimum": 1, "maximum": 6, "default": 3 }
      }
    },
    "prompts": {
      "description": "Replacements for the game's own wording, by name: how the rules are explained to the story model (narrator_mechanics, narrator_prose, narrator_records, leaving_prose, leaving_records), how a reply is laid out so each paragraph can be shown under a character's name (narrator_layout), the time and place line that heads each reply (narrator_header), what a character can know of turns they were not present for (narrator_knowledge), the checklist a thinking model goes through before it writes, when the player has that switched on (narrator_check), how the card's own instructions are given the last word (card_instructions, card_reminder) and the whole prompt of each helper job (resolve_actions, record_changes, judge_quests, direct_scene, suggest_choices, summarize, write_journal, move_world). Leave one out to use the game's own. The defaults, and which {{parts}} the game fills in for each, are in game/aigame/wording.py; the creator's preset builder shows them. A part left out of a replacement is added at its end.",
      "type": "object",
      "additionalProperties": { "type": "string" }
    },
    "blocks": {
      "description": "Prompt is built top to bottom from enabled blocks, with one rule that overrides the order: the slots that change during play (summary, lorebook, state, quests) are always sent with the newest message, after the history. That keeps the start of the prompt identical from turn to turn, which is what lets providers cache it. Text blocks placed below the history slot are sent after the player's newest message, as the very last thing the model reads, every turn.",
      "type": "array",
      "items": {
        "type": "object",
        "required": ["id", "name", "kind"],
        "additionalProperties": false,
        "properties": {
          "id": { "type": "string", "pattern": "^[a-z0-9_]+$" },
          "name": { "type": "string", "description": "Label shown next to the toggle." },
          "help": { "type": "string", "description": "One-line explanation shown in simple mode." },
          "enabled": { "type": "boolean", "default": true },
          "kind": {
            "enum": ["text", "slot"],
            "description": "text: author-written content. slot: filled by the engine from the card and save."
          },
          "role": { "enum": ["system", "user", "assistant"], "default": "system" },
          "content": { "type": "string", "description": "For text blocks. Supports {{user}} and {{currency}}." },
          "slot": {
            "enum": ["world", "narrator_instructions", "persona", "characters", "lorebook", "state", "quests", "summary", "history", "action_protocol"],
            "description": "For slot blocks. action_protocol is required for game mechanics and cannot be disabled."
          },
          "simple": { "type": "boolean", "default": false, "description": "Show this toggle in simple mode." }
        },
        "allOf": [
          { "if": { "properties": { "kind": { "const": "text" } } }, "then": { "required": ["content"] } },
          { "if": { "properties": { "kind": { "const": "slot" } } }, "then": { "required": ["slot"] } }
        ]
      }
    }
  }
}
